identifier;author;title;journal;year;group-short;group-long;country
Giatsoglou2017;Giatsoglou, Maria and Vozalis, Manolis G and Diamantaras, Konstantinos and Vakali, Athena and Sarigiannidis, George and Chatzisavvas, Konstantinos Ch;Sentiment analysis leveraging emotions and word embeddings;Expert Systems with Applications;2017;classification-system-and-application-areas;classification-system-and-application-areas-sentiment-analysis;Greece, Greece, Greece, Greece, Greece, Greece
Li:2009:FFS:1690219.1690243;Li, Shoushan and Xia, Rui and Zong, Chengqing and Huang, Chu-Ren;A Framework of Feature Selection Methods for Text Categorization;Proceedings of the Joint Conference of the 47th Annual Meeting of the ACL and the 4th International Joint Conference on Natural Language Processing of the AFNLP: Volume 2 - Volume 2;2009;feature-selection;feature-selection;Hong Kong, China, China, Hong Kong
Liu2014;James N. K. Liu and Yu{-}Lin He and Edward H. Y. Lim and Xizhao Wang;Domain ontology graph model and its application in Chinese text classification;Neural Computing and Applications;2014;feature-construction;feature-construction;Hong Kong, China, Hong Kong, China
Tan2014;Ben Tan and Erheng Zhong and Evan Wei Xiang and Qiang Yang;Multi-transfer: Transfer learning with multiple views and multiple sources;Statistical Analysis and Data Mining;2014;learning-transfer;learning-transfer;Hong Kong, Hong Kong, Hong Kong, Hong Kong
Li2014;Xiaodong Li and Haoran Xie and Li Chen and Jianping Wang and Xiaotie Deng;News impact on stock price return via sentiment analysis;Knowledge-Based Systems;2014;classification-system-and-application-areas;classification-system-and-application-areas;Hong Kong, Hong Kong, Hong Kong, Hong Kong, China
Saha2013;Sriparna Saha and Asif Ekbal;Combining multiple classifiers using vote based classifier ensemble technique for named entity recognition;Data \& Knowledge Engineering;2013;feature-construction;feature-construction;India, India
Vinodhini2016;Vinodhini, G and Chandrasekaran, RM;A comparative performance evaluation of neural network based approach for sentiment classification of online reviews;Journal of King Saud University-Computer and Information Sciences;2016;classification-system-and-application-areas;classification-system-and-application-areas;India, India
Ravi2017;Ravi, Kumar and Ravi, Vadlamani;A novel automatic satire and irony detection using ensembled feature selection and data mining;Knowledge-Based Systems;2017;feature-selection;feature-selection;India, India
Kumar2016128;B. Shravan Kumar and Vadlamani Ravi;A survey of the applications of text mining in financial domain;Knowledge-Based Systems;2016;classification-system-and-application-areas;classification-system-and-application-areas;India, India
Bhushan2017;Bhushan, SN Bharath and Danti, Ajit;Classification of text documents based on score level fusion approach;Pattern Recognition Letters;2017;learning-multiview;learning-multiview;India, India
Agnihotri2017;Agnihotri, Deepak and Verma, Kesari and Tripathi, Priyanka;Variable Global Feature Selection Scheme for automatic classification of text documents;Expert Systems with Applications;2017;feature-selection;feature-selection;India, India, India
Tripathy2017;Abinash Tripathy and Abhishek Anand and Santanu Kumar Rath;Document-level sentiment classification using hybrid machine learning approach;Knowledge and Information Systems;2017;classification-system-and-application-areas;classification-system-and-application-areas-sentiment-analysis;India, India, India
Manek2017;Manek, Asha S and Shenoy, P Deepa and Mohan, M Chandra and Venugopal, KR;Aspect term extraction for sentiment analysis in large movie reviews using Gini Index feature selection method and SVM classifier;World Wide Web;2017;feature-construction;feature-construction;India, India, India, India
Labani2018;Labani, Mahdieh and Moradi, Parham and Ahmadizar, Fardin and Jalili, Mahdi;A novel multivariate filter method for feature selection in text classification problems;Engineering Applications of Artificial Intelligence;2018;feature-selection;feature-selection;Iran, Iran, Iran, Australia
Sheikhpour2017;Razieh Sheikhpour and Mehdi Agha Sarram and Sajjad Gharaghani and Mohammad Ali Zare Chahooki;A Survey on semi-supervised feature selection methods;Pattern Recognition;2017;feature-selection;feature-selection;Iran, Iran, Iran, Iran
Hu2016;Hu, Rong and Mac Namee, Brian and Delany, Sarah Jane;Active learning for text classification with reusability;Expert Systems with Applications;2016;learning-active;learning-active;Ireland, Ireland, Ireland
Nunzio2014;Giorgio Maria Di Nunzio;"A new decision to take for cost-sensitive Na{\""{\i}}ve Bayes classifiers";Information Processing and Management;2014;;;Italy
Cagliero2013;Luca Cagliero and Paolo Garza;Improving classification models with taxonomy information;Data \& Knowledge Engineering;2013;feature-construction;feature-construction;Italy, Italy
Pillai2017;Pillai, Ignazio and Fumera, Giorgio and Roli, Fabio;Designing multi-label classifiers that maximize F measures: State of the art;Pattern Recognition;2017;learning-classification-multilabel;learning-classification-multilabel;Italy, Italy, Italy
Baroni2014;Baroni, Marco and Dinu, Georgiana and Kruszewski, Germ{\'a}n;Don't count, predict! A systematic comparison of context-counting vs. context-predicting semantic vectors;Proceedings of the 52nd Annual Meeting of the Association for Computational Linguistics (Volume 1: Long Papers);2014;feature-construction;feature-construction;Italy, Italy, Italy
Ren2013;Fuji Ren and Mohammad Golam Sohrab;Class-indexing-based term weighting for automatic text classification;Information Sciences;2013;feature-weight;feature-weight;Japan, Japan
Ogura2011;Hiroshi Ogura and Hiromi Amano and Masato Kondo;Comparison of metrics for feature selection in imbalanced text classification;Expert Systems with Applications;2011;feature-selection;feature-selection;Japan, Japan, Japan
Jalilvand2017;Jalilvand, Abbas and Salim, Naomie;Feature unionization: A novel approach for dimension reduction;Applied Soft Computing;2017;feature-selection;feature-selection;Malaysia, Iran
Hajmohammadi2014;Mohammad Sadegh Hajmohammadi and Roliana Ibrahim and Ali Selamat;Cross-lingual sentiment classification using multiple source languages in multi-view semi-supervised learning;Engineering Applications of Artificial Intelligence;2014;learning-multiview;learning-multiview;Malaysia, Malaysia, Malaysia
Ghareb2016;Ghareb, Abdullah Saeed and Bakar, Azuraliza Abu and Hamdan, Abdul Razak;Hybrid feature selection based on enhanced genetic algorithm for text categorization;Expert Systems with Applications;2016;feature-selection;feature-selection;Malaysia, Malaysia, Malaysia
Al-Salemi2016;Al-Salemi, Bassam and Noah, Shahrul Azman Mohd and Ab Aziz, Mohd Juzaiddin;RFBoost: an improved multi-label boosting algorithm and its application to text categorisation;Knowledge-Based Systems;2016;learning-classification-multilabel;learning-classification-multilabel;Malaysia, Malaysia, Malaysia
Lee2012;Lee, Lam Hong and Isa, Dino and Choo, Wou Onn and Chue, Wen Yeen;High Relevance Keyword Extraction facility for Bayesian text classification on different domains of varying characteristic;Expert Systems with Applications;2012;feature-construction;feature-construction;Malaysia, Malaysia, Malaysia, Malaysia
Saloot2016;Saloot, Mohammad Arshi and Idris, Norisma and Mahmud, Rohana and Jaafar, Salinah and Thorleuchter, Dirk and Gani, Abdullah;Hadith data mining and classification: a comparative analysis;Artificial Intelligence Review;2016;classification-system-and-application-areas;classification-system-and-application-areas;Malaysia, Malaysia, Malaysia, Malaysia, Germany, Malaysia
Sabbah2016;Thabit Sabbah and Ali Selamat and Md. Hafiz Selamat and Roliana Ibrahim and Hamido Fujita;Hybridized term-weighting method for Dark Web classification;Neurocomputing;2016;classification-system-and-application-areas;classification-system-and-application-areas;Malaysia, Malaysia, Malaysia, Malaysia, Japan
Sharef2015;Sharef, Nurfadhlina Mohd and Martin, Trevor;Evolving fuzzy grammar for crime texts categorization;Applied Soft Computing;2015;learning-interpretable-model;learning-interpretable-model;Malaysia, United Kingdom
Escalante2015;Hugo Jair Escalante and Mauricio A. Garc{\'{\i}}a{-}Lim{\'{o}}n and Alicia Morales{-}Reyes and Mario Graff and Manuel Montes{-}y{-}G{\'{o}}mez and Eduardo F. Morales and Jos{\'{e}} Mart{\'{\i}}nez{-}Carranza;Term-weighting learning via genetic programming for text classification;Knowledge-Based Systems;2015;feature-weight;feature-weight;Mexico, Mexico, Mexico, Mexico, Mexico, Mexico, Mexico
Olvera-Lopez2010;Jos{\'{e}} Arturo Olvera{-}L{\'{o}}pez and Jes{\'{u}}s Ariel Carrasco{-}Ochoa and Jos{\'{e}} Francisco Mart{\'{\i}}nez Trinidad and Josef Kittler;A review of instance selection methods;Artificial Intelligence Review;2010;instance-selection;instance-selection;Mexico, Mexico, Mexico, United Kingdom
Ting97stackedgeneralization;Kai Ming Ting and Ian H. Witten;Proceedings International Joint Conference on Artificial Intelligence;Proceedings International Joint Conference on Artificial Intelligence;1997;learning-ensamble;learning-ensamble;New Zealand, New Zealand
Foulds2010;Foulds, James and Frank, Eibe;A review of multi-instance learning assumptions;The Knowledge Engineering Review;2010;learning-multiple-instance;learning-multiple-instance;New Zealand, New Zealand
Rehman2017;Rehman, Abdur and Javed, Kashif and Babri, Haroon A;Feature selection based on a normalized difference measure for text classification;Information Processing and Management;2017;feature-selection;feature-selection;Pakistan, Pakistan, Pakistan
Sabbah2017;Sabbah, Thabit and Selamat, Ali and Selamat, Md Hafiz and Al-Anzi, Fawaz S and Viedma, Enrique Herrera and Krejcar, Ondrej and Fujita, Hamido;Modified frequency-based term weighting schemes for text classification;Applied Soft Computing;2017;feature-weight;feature-weight;Palestine, Malaysia, Malaysia, Kuwait, Spain, Czech Republic, Japan
Wozniak2014;Wo{\'z}niak, Micha{\l} and Gra{\~n}a, Manuel and Corchado, Emilio;A survey of multiple classifier systems as hybrid systems;Information Fusion;2014;learning-multiview;learning-multiview;Poland, Spain, Spain
Basto-Fernandes2016;Basto-Fernandes, Vitor and Yevseyeva, Iryna and M{\'e}ndez, Jos{\'e} R and Zhao, Jiaqi and Fdez-Riverola, Florentino and Emmerich, Michael TM;A spam filtering multi-objective optimization study covering parsimony maximization and three-way classification;Applied Soft Computing;2016;classification-system-and-application-areas;classification-system-and-application-areas;Portugal, United Kingdom, Spain, China, Spain, The Netherlands
Kim2016;Hyun Kyung Kim and Minyoung Kim;Model-induced term-weighting schemes for text classification;Applied Intelligence;2016;feature-weight;feature-weight;Republic of Korea, Republic of Korea
Li2009a;Cheng Hua Li and Soon Cheol Park;An efficient document classification model using an improved back propagation neural network and singular value decomposition;Expert Systems with Applications;2009;feature-projection;feature-projection;Republic of Korea, Republic of Korea
Yoon2007;Yongwook Yoon and Gary Geunbae Lee;Efficient implementation of associative classifiers for document classification;Information Processing and Management;2007;classification-system-and-application-areas;classification-system-and-application-areas;Republic of Korea, Republic of Korea
Kang2015;Kang, Seokho and Cho, Sungzoon and Kang, Pilsung;Multi-class classification via heterogeneous ensemble of one-class classifiers;Engineering Applications of Artificial Intelligence;2015;learning-classification-multiclass;learning-classification-multiclass;Republic of Korea, Republic of Korea, Republic of Korea
Ali2017257;Rahman Ali and Sungyoung Lee and Tae Choong Chung;Accurate multi-criteria decision making methodology for recommending machine learning algorithm;Expert Systems with Applications;2017;evaluation-methods;evaluation-methods;Republic of Korea, Republic of Korea, Republic of Korea
Kang2018;Kang, Mangi and Ahn, Jaelim and Lee, Kichun;Opinion mining using ensemble text hidden Markov models for text classification;Expert Systems with Applications;2018;classification-system-and-application-areas;classification-system-and-application-areas-sentiment-analysis;Republic of Korea, Republic of Korea, Republic of Korea
Ko2004;Youngjoong Ko and Jinwoo Park and Jungyun Seo;Improving text categorization using the importance of sentences;Information Processing and Management;2004;feature-construction;feature-construction;Republic of Korea, Republic of Korea, Republic of Korea
Lim2005;Chul Su Lim and Kong Joo Lee and Gil{-}Chang Kim;Multiple sets of features for automatic genre classification of web documents;Information Processing and Management;2005;learning-multiview;learning-multiview;Republic of Korea, Republic of Korea, Republic of Korea
Choi2014;Dongjin Choi and Byeong{-}Kyu Ko and Heesun Kim and Pankoo Kim;Text analysis for detecting terrorism-related articles on the web;Journal of Network and Computer Applications;2014;classification-system-and-application-areas;classification-system-and-application-areas;Republic of Korea, Republic of Korea, Republic of Korea, Republic of Korea
Fattah2015;Mohamed Abdel Fattah;New term weighting schemes with combination of multiple classifiers for sentiment analysis;Neurocomputing;2015;feature-weight;feature-weight;Saudi Arabia
Diab2017;Diab, Diab M and El Hindi, Khalil M;"Using differential evolution for fine tuning na{\""\i}ve Bayesian classifiers and its application for text classification";Applied Soft Computing;2017;classification-system-and-application-areas;classification-system-and-application-areas;Saudi Arabia, Saudi Arabia
Kan:2005:FWC:1099554.1099649;Kan, Min-Yen and Thi, Hoang Oanh Nguyen;Fast Webpage Classification Using URL Features;Proceedings of the 14th ACM International Conference on Information and Knowledge Management;2005;classification-system-and-application-areas;classification-system-and-application-areas;Singapore, Singapore
Chaturvedi2016;Iti Chaturvedi and Yew{-}Soon Ong and Ivor W. Tsang and Roy E. Welsch and Erik Cambria;Learning word dependencies in text by means of a deep recurrent belief network;Knowledge-Based Systems;2016;feature-construction;feature-construction;Singapore, Singapore, Australia, United States, Singapore
Nguyen2015;Nguyen, Hai-Long and Woon, Yew-Kwong and Ng, Wee-Keong;A survey on data stream clustering and classification;Knowledge and Information Systems;2015;classification-system-and-application-areas;classification-system-and-application-areas-text-data-streams;Singapore, Singapore, Singapore
Sajgalik2017;Sajgalik, Marius and Barla, Michal and Bielikova, Maria;Searching for discriminative words in multidimensional continuous feature space;Computer Speech \& Language;2017;feature-selection;feature-selection;Slovakia, Slovakia, Slovakia
Demsar2006;Janez Demsar;Statistical Comparisons of Classifiers over Multiple Data Sets;Journal of Machine Learning Research;2006;evaluation-methods;evaluation-methods;Slovenia
Pavlinek2017;Miha Pavlinek and Vili Podgorelec;Text classification method based on self-training and LDA;Expert Systems with Applications;2017;feature-construction;feature-construction;Slovenia, Slovenia
Santafe2015;Santafe, Guzman and Inza, I{\~{n}}aki and Lozano, Jose A.;Dealing with the evaluation of supervised classification algorithms;Artificial Intelligence Review;2015;evaluation-methods;evaluation-methods;Spain, Spain, Spain
Enriquez2016;Fernando Enr{\'{\i}}quez and Jos{\'{e}} A. Troyano and Tom{\'{a}}s L{\'{o}}pez{-}Solaz;An approach to the use of word embeddings in an opinion classification task;Expert Systems with Applications;2016;feature-construction;feature-construction;Spain, Spain, Spain
Garcia-Pablos2018;Garc{\'\i}a-Pablos, Aitor and Cuadros, Montse and Rigau, German;W2VLDA: Almost Unsupervised System for Aspect Based Sentiment Analysis;Expert Systems with Applications;2018;classification-system-and-application-areas;classification-system-and-application-areas-sentiment-analysis;Spain, Spain, Spain
Garcia2017;Garc{\'\i}a, Marcos Antonio Mouri{\~n}o and Rodr{\'\i}guez, Roberto P{\'e}rez and Rif{\'o}n, Luis Anido;Wikipedia-based cross-language text classification;Information Sciences;2017;classification-system-and-application-areas;classification-system-and-application-areas-cross-multi-lingual;Spain, Spain, Spain
Ibanez2014;Alfonso Ib{\'{a}}{\~{n}}ez and Concha Bielza and Pedro Larra{\~{n}}aga;Cost-sensitive selective naive Bayes classifiers for predicting the increase of the h-index for scientific journals;Neurocomputing;2014;;;Spain, Spain, Spain
Zelaia2011;Zelaia, Ana and Alegria, I{\~n}aki and Arregi, Olatz and Sierra, Basilio;A multiclass/multilabel document categorization system: Combining multiple classifiers in a reduced dimension;Applied Soft Computing;2011;learning-ensamble;learning-ensamble;Spain, Spain, Spain, Spain
GarcaAdeva20141498;J.J. García Adeva and J.M. Pikatza Atxa and M. Ubeda Carrillo and E. Ansuategi Zengotitabengoa;Automatic text classification to support systematic reviews in medicine;Expert Systems with Applications;2014;classification-system-and-application-areas;classification-system-and-application-areas;Spain, Spain, Spain, Spain
Araque2017;Araque, Oscar and Corcuera-Platas, Ignacio and S{\'a}nchez-Rada, J Fernando and Iglesias, Carlos A;Enhancing deep learning sentiment analysis with ensemble techniques in social applications;Expert Systems with Applications;2017;classification-system-and-application-areas;classification-system-and-application-areas-sentiment-analysis;Spain, Spain, Spain, Spain
Seijo-Pardo2017;Borja Seijo{-}Pardo and Iago Porto{-}D{\'{\i}}az and Ver{\'{o}}nica Bol{\'{o}}n{-}Canedo and Amparo Alonso{-}Betanzos;Ensemble feature selection: Homogeneous and heterogeneous approaches;Knowledge-Based Systems;2017;feature-selection;feature-selection;Spain, Spain, Spain, Spain
DBLP:journals/ir/GiachanouSP15;Anastasia Giachanou and Michail Salampasis and Georgios Paltoglou;Multilayer source selection as a tool for supporting patent search and classification;Information Retrieval Journal;2015;classification-system-and-application-areas;classification-system-and-application-areas;Switzerland, Greece, United Kingdom
Lin2009;Shui{-}Shun Lin;A document classification and retrieval system for R{\&}D in semiconductor industry - {A} hybrid approach;Expert Systems with Applications;2009;classification-system-and-application-areas;classification-system-and-application-areas;Taiwan
Wong20152839;Tzu-Tsung Wong;Performance evaluation of classification algorithms by k-fold and leave-one-out cross validation;Pattern Recognition;2015;evaluation-methods;evaluation-methods;Taiwan
Tsai2013;Chih{-}Fong Tsai and Che{-}Wei Chang;{SVOIS:} Support Vector Oriented Instance Selection for text classification;Information Sciences;2013;instance-selection;instance-selection;Taiwan, Taiwan
Trappey2006;Amy J. C. Trappey and Fu{-}Chiang Hsu and Charles V. Trappey and Chia{-}I Lin;Development of a patent document classification and search platform using a back-propagation network;Expert Systems with Applications;2006;classification-system-and-application-areas;classification-system-and-application-areas;Taiwan, Taiwan, Australia, Taiwan
Wei2011;Wei, Chih-Ping and Lin, Yen-Ting and Yang, Christopher C;Cross-lingual text categorization: Conquering language boundaries in globalized environments;Information Processing and Management;2011;classification-system-and-application-areas;classification-system-and-application-areas-cross-multi-lingual;Taiwan, Taiwan, United States
JMLR:v15:vandermaaten14a;Laurens van der Maaten;Accelerating t-SNE using Tree-Based Algorithms;Journal of Machine Learning Research;2014;feature-projection;feature-projection;The Netherlands
ictdbid:2777;Laurens van der Maaten and Geoffrey E. Hinton;Visualizing High-Dimensional Data Using t-SNE;Journal of Machine Learning Research;2008;feature-projection;feature-projection;The Netherlands, Canada
Vanderlooy2008;"Stijn Vanderlooy and Eyke H{\""{u}}llermeier";A critical analysis of variants of the AUC;Machine Learning;2008;evaluation-methods;evaluation-methods;The Netherlands, Germany
Knijff2013;Jeroen de Knijff and Flavius Frasincar and Frederik Hogenboom;Domain taxonomy learning from text: The subsumption method versus hierarchical clustering;Data \& Knowledge Engineering;2013;feature-construction;feature-construction;The Netherlands, The Netherlands, The Netherlands
Duin2010;Duin, Robert PW and Loog, Marco and P{\c e}kalska, El{\.z}bieta and Tax, David MJ;Feature-Based Dissimilarity Space Classification;Recognizing Patterns in Signals, Speech, Images and Videos;2010;feature-construction;feature-construction;The Netherlands, The Netherlands, United Kingdom, The Netherlands
Uysal2016;Uysal, Alper Kursat;An improved global feature selection scheme for text classification;Expert Systems with Applications;2016;feature-selection;feature-selection;Turkey
Uguz2011;Harun Uguz;A two-stage feature selection method for text categorization by using information gain, principal component analysis and genetic algorithm;Knowledge-Based Systems;2011;feature-projection;feature-projection;Turkey
Alpaydin2015;Alpayd{\i}n, Ethem and Cheplygina, Veronika and Loog, Marco and Tax, David MJ;Single-vs. multiple-instance classification;Pattern Recognition;2015;learning-multiple-instance;learning-multiple-instance;Turkey, The Netherlands, The Netherlands, The Netherlands
Altincay2014;Alt{\i}n{\c{c}}ay, Hakan and Erenel, Zafer;Ternary encoding based feature extraction for binary text classification;Applied Intelligence;2014;learning-classification-binaryclass;learning-classification-binaryclass;Turkey, Turkey
Catal2017135;Cagatay Catal and Mehmet Nangir;A sentiment classification model based on multiple classifiers;Applied Soft Computing;2017;classification-system-and-application-areas;classification-system-and-application-areas, learning-ensamble;Turkey, Turkey
Badawi2014;Dima Badawi and Hakan Altin{\c{c}}ay;A novel framework for termset selection and weighting in binary text classification;Engineering Applications of Artificial Intelligence;2014;feature-selection;feature-selection;Turkey, Turkey
Altinel2016;Alt{\i}nel, Berna and Ganiz, Murat Can;A new hybrid semi-supervised algorithm for text classification with class-based semantics;Knowledge-Based Systems;2016;learning-semi-suppervised;learning-semi-suppervised;Turkey, Turkey
Uysal2012;"Alper Kursat Uysal and Serkan G{\""{u}}nal";A novel probabilistic feature selection method for text classification;Knowledge-Based Systems;2012;feature-selection;feature-selection;Turkey, Turkey
7130164;B. Parlak and A. K. Uysal;Classification of medical documents according to diseases;Proceedings of the 23nd Signal Processing and Communications Applications Conference (SIU);2015;classification-system-and-application-areas;classification-system-and-application-areas;Turkey, Turkey
Altinel2015;Alt{\i}nel, Berna and Ganiz, Murat Can and Diri, Banu;A corpus-based semantic kernel for text classification by using meaning values of terms;Engineering Applications of Artificial Intelligence;2015;feature-construction;feature-construction;Turkey, Turkey, Turkey
Altinel2017;Alt{\i}nel, Berna and Ganiz, Murat Can and Diri, Banu;Instance labeling in semi-supervised learning with meaning values of words;Engineering Applications of Artificial Intelligence;2017;learning-semi-suppervised;learning-semi-suppervised;Turkey, Turkey, Turkey
Onan2016;Onan, Aytu{\u{g}} and Koruko{\u{g}}lu, Serdar and Bulut, Hasan;A multiobjective weighted voting ensemble classifier based on differential evolution algorithm for text sentiment classification;Expert Systems with Applications;2016;classification-system-and-application-areas;classification-system-and-application-areas-sentiment-analysis;Turkey, Turkey, Turkey
ONAN2016232;Aytug Onan and Serdar Korukoglu and Hasan Bulut;Ensemble of keyword extraction methods and classifiers in text classification;Expert Systems with Applications;2016;feature-construction;feature-construction;Turkey, Turkey, Turkey
Tutkan2016;Tutkan, Melike and Ganiz, Murat Can and Akyoku{\c{s}}, Selim;Helmholtz principle based supervised and unsupervised feature selection methods for text mining;Information Processing and Management;2016;feature-selection;feature-selection;Turkey, Turkey, Turkey
Li20071183;Yaoyong Li and John Shawe-Taylor;Advanced learning algorithms for cross-language patent retrieval and classification;Information Processing and Management;2007;classification-system-and-application-areas;classification-system-and-application-areas;United Kingdom, United Kingdom
Bandhakavi2017;Anil Bandhakavi and Nirmalie Wiratunga and Deepak Padmanabhan and Stewart Massie;Lexicon based feature extraction for emotion text classification;Pattern Recognition Letters;2017;feature-construction;feature-construction;United Kingdom, United Kingdom, United Kingdom, United Kingdom
DBLP:conf/trec/RobertsonWJHG94;Stephen E. Robertson and Steve Walker and Susan Jones and Micheline Hancock-Beaulieu and Gatford, M;Okapi at TREC-3;;1994;feature-weight;feature-weight;United Kingdom, United Kingdom, United Kingdom, United Kingdom, United Kingdom
Burges2010;Christopher J. C. Burges;Dimension Reduction: {A} Guided Tour;Foundations and Trends in Machine Learning;2010;feature-projection;feature-projection;United States
Ke2015;Weimao Ke;Information-theoretic term weighting schemes for document clustering and classification;International Journal on Digital Libraries;2015;feature-weight;feature-weight;United States
