identifier;author;title;journal;year;group-short;group-long;country
Wolpert92stackedgeneralization;David H. Wolpert;Stacked Generalization;Neural Networks;1992;learning-ensamble;learning-ensamble;United States
Mostafa2000415;J. Mostafa and W. Lam;Automatic classification using supervised learning in a medical document filtering application;Information Processing and Management;2000;classification-system-and-application-areas;classification-system-and-application-areas;United States, China
Wang2009;Pu Wang and Jian Hu and Hua{-}Jun Zeng and Zheng Chen;Using Wikipedia knowledge to improve text classification;Knowledge and Information Systems;2009;feature-construction;feature-construction;United States, China, China, China
Guyon:2003:IVF:944919.944968;Guyon, Isabelle and Elisseeff, Andr{\'e};An Introduction to Variable and Feature Selection;Journal of Machine Learning Research;2003;feature-selection;feature-selection;United States, Germany
Sun2016;Sun, Baochen and Feng, Jiashi and Saenko, Kate;Return of Frustratingly Easy Domain Adaptation.;Proceedings of the Thirtieth AAAI Conference on Artificial Intelligence;2016;learning-transfer;learning-transfer;United States, Singapore, United States
Cunningham2015;Cunningham, John P and Ghahramani, Zoubin;Linear dimensionality reduction: survey, insights, and generalizations.;Journal of Machine Learning Research;2015;feature-projection;feature-projection;United States, United Kingdom
Krawczyk2017;Krawczyk, Bartosz and Minku, Leandro L and Gama, Jo{\~a}o and Stefanowski, Jerzy and Wo{\'z}niak, Micha{\l};Ensemble learning for data stream analysis: a survey;Information Fusion;2017;learning-ensamble-data-stream;learning-ensamble-data-stream;United States, United Kingdom, Portugal, Poland, Poland
Qi:2009:WPC:1459352.1459357;Qi, Xiaoguang and Davison, Brian D.;Web Page Classification: Features and Algorithms;ACM Computing Surveys;2009;classification-system-and-application-areas;classification-system-and-application-areas;United States, United States
Forman2010;Forman, George and Scholz, Martin;Apples-to-apples in Cross-validation Studies: Pitfalls in Classifier Performance Measurement;ACM SIGKDD Explorations Newsletter;2010;evaluation-methods;evaluation-methods;United States, United States
Do2006;Do, Chuong B and Ng, Andrew Y;Transfer learning for text classification;Advances in Neural Information Processing Systems;2006;learning-transfer;learning-transfer;United States, United States
Kontostathis2006;April Kontostathis and William M. Pottenger;A framework for understanding Latent Semantic Indexing (LSI);Information Processing and Management;2006;feature-projection;feature-projection;United States, United States
Ruiz2002;Ruiz, Miguel E and Srinivasan, Padmini;Hierarchical text categorization using neural networks;Information Retrieval Journal;2002;learning-classification-hierarhical;learning-classification-hierarhical;United States, United States
Aggarwal2012;Aggarwal, Charu C and Zhai, Cheng Xiang;A survey of text classification algorithms;Mining text data;2012;review-survey-overview-works;review-survey-overview-works;United States, United States
Blum1998;Blum, Avrim and Mitchell, Tom;Proceedings of the eleventh annual conference on Computational learning theory;Proceedings of the eleventh annual conference on Computational learning theory;1998;learning-semi-suppervised;learning-semi-suppervised;United States, United States
Mihalcea2011;Mihalcea, Rada and Radev, Dragomir;Graph-based natural language processing and information retrieval;;2011;document-representation;document-representation;United States, United States
7393866;B. Tang and H. He and P. M. Baggenstoss and S. Kay;A Bayesian Classification Approach Using Class-Specific Features for Text Categorization;IEEE Transactions on Knowledge and Data Engineering;2016;feature-selection;feature-selection;United States, United States, Germany, United States
Zhou2010;Yang Zhou and Rong Jin and Steven C. H. Hoi;Exclusive Lasso for Multi-task Feature Selection;Proceedings of the Thirteenth International Conference on Artificial Intelligence and Statistics, AISTATS;2010;feature-selection;feature-selection;United States, United States, Singapore
Schenker2005a;Schenker, A and Bunke, H and Last, M and Kandel, A;Graph-Theoretic Techniques for Web Content Mining. Series in Machine Perception and Artificial Intelligence, vol. 62;;2005;document-representation;document-representation;United States, United States, Switzerland, Israel
Abbasi2008;Abbasi, Ahmed and Chen, Hsinchun and Salem, Arab;Sentiment analysis in multiple languages: Feature selection for opinion classification in web forums;ACM Transactions on Information Systems;2008;classification-system-and-application-areas;classification-system-and-application-areas;United States, United States, United States
Tang2016;Bo Tang and Steven Kay and Haibo He;Toward Optimal Feature Selection in Naive Bayes for Text Categorization;IEEE Transactions on Knowledge and Data Engineering;2016;feature-selection;feature-selection;United States, United States, United States
Weiss2016;Weiss, Karl and Khoshgoftaar, Taghi M and Wang, DingDing;A survey of transfer learning;Journal of Big Data;2016;learning-transfer;learning-transfer;United States, United States, United States
Bui2016;Bui, Duy Duc An and Del Fiol, Guilherme and Jonnalagadda, Siddhartha;PDF text classification to leverage information extraction from publication reports;Journal of biomedical informatics;2016;classification-system-and-application-areas;classification-system-and-application-areas;United States, United States, United States
Kim2005;Kim, Hyunsoo and Howland, Peg and Park, Haesun;Dimension reduction in text classification with support vector machines;Journal of Machine Learning Research;2005;feature-projection;feature-projection;United States, United States, United States
Dasigi2001;Venu Dasigi and Reinhold C. Mann and Vladimir A. Protopopescu;Information fusion for text classification - an experimental comparison;Pattern Recognition;2001;learning-multiview;learning-multiview;United States, United States, United States
Mikolov2013;Mikolov, Tomas and Yih, Wen-tau and Zweig, Geoffrey;Linguistic regularities in continuous space word representations.;Proceedings of the 2013 Conference of the North American Chapter of the Association for Computational Linguistics: Human Language Technologies (NAACL-HLT-2013);2013;feature-construction;feature-construction;United States, United States, United States
Pennington2014;Pennington, Jeffrey and Socher, Richard and Manning, Christopher;Glove: Global vectors for word representation;Proceedings of the 2014 conference on empirical methods in natural language processing (EMNLP);2014;feature-construction;feature-construction;United States, United States, United States
Gollapalli:2015:IRH:2830542.2767135;Gollapalli, Sujatha Das and Caragea, Cornelia and Mitra, Prasenjit and Giles, C. Lee;Improving Researcher Homepage Classification with Unlabeled Data;ACM Transactions on the Web;2015;classification-system-and-application-areas;classification-system-and-application-areas;United States, United States, United States, United States
Gollapalli:2011:IAH:1998076.1998099;Gollapalli, Sujatha Das and Giles, C. Lee and Mitra, Prasenjit and Caragea, Cornelia;On Identifying Academic Homepages for Digital Libraries;Proceedings of the 11th Annual International ACM/IEEE Joint Conference on Digital Libraries;2011;classification-system-and-application-areas;classification-system-and-application-areas;United States, United States, United States, United States
Gollapalli:2013:RHC:2488388.2488430;Gollapalli, Sujatha Das and Caragea, Cornelia and Mitra, Prasenjit and Giles, C. Lee;Researcher Homepage Classification Using Unlabeled Data;Proceedings of the 22Nd International Conference on World Wide Web;2013;classification-system-and-application-areas;classification-system-and-application-areas;United States, United States, United States, United States
VanLinh2017;Van Linh, Ngo and Anh, Nguyen Kim and Than, Khoat and Dang, Chien Nguyen;An effective and interpretable method for document classification;Knowledge and Information Systems;2017;classification-system-and-application-areas;classification-system-and-application-areas;Vietnam, Vietnam, Vietnam, Vietnam
ba28090bc0e64ddaacc012717148d888;Tony Bellotti and Ilia Nouretdinov and Meng Yang and Alex Gammerman;Feature Selection;Conformal Prediction for Reliable Machine Learning;2014;feature-selection;feature-selection;
ref1;Sammut, Claude and Webb, Geoffrey I.;Encyclopedia of Machine Learning;Encyclopedia of Machine Learning;2010;evaluation-methods;evaluation-methods;
ref1roc;Sammut, Claude and Webb, Geoffrey I.;Encyclopedia of Machine Learning;Encyclopedia of Machine Learning;2010;evaluation-methods;evaluation-methods;
Flach2010;Flach, Peter A.;Encyclopedia of Machine Learning;Encyclopedia of Machine Learning;2010;evaluation-methods;evaluation-methods;
Vlachos2010;Vlachos, Michail;Encyclopedia of Machine Learning;Encyclopedia of Machine Learning;2010;feature-projection;feature-projection, feature-selection;
Cohn2010;Cohn, David;Encyclopedia of Machine Learning;Encyclopedia of Machine Learning;2010;learning-active;learning-active;
Sammut2010;Sammut, Claude and Webb, Geoffrey I.;Encyclopedia of Machine Learning;Encyclopedia of Machine Learning;2010;learning-ensamble;learning-ensamble;
Muslea2010;Muslea, Ion;Encyclopedia of Machine Learning;Encyclopedia of Machine Learning;2010;learning-semi-suppervised;learning-semi-suppervised;
Zhu2010;Zhu, Xiaojin;Encyclopedia of Machine Learning;Encyclopedia of Machine Learning;2010;learning-semi-suppervised;learning-semi-suppervised;
Vilalta2010;Vilalta, Ricardo and Giraud-Carrier, Christophe and Brazdil, Pavel and Soares, Carlos;Encyclopedia of Machine Learning;Encyclopedia of Machine Learning;2010;learning-transfer;learning-transfer;
Ray2010;Ray, Soumya and Scott, Stephen and Blockeel, Hendrik;Multi-Instance Learning;Encyclopedia of Machine Learning;2010;learning-multiple-instance;learning-multiple-instance;
MLSL2010;Sammut, Claude and Webb, Geoffrey I.;Encyclopedia of Machine Learning and Data Mining;Encyclopedia of Machine Learning and Data Mining;2017;;;
Sammon:1969:NMD:1310162.1310727;Sammon, J. W.;A Nonlinear Mapping for Data Structure Analysis;IEEE Transactions on Computers;1969;feature-projection;feature-projection;
Witten2016;Witten, Ian H and Frank, Eibe and Hall, Mark A and Pal, Christopher J;Data Mining: Practical machine learning tools and techniques;;2016;;;
Brown2010;Brown, Gavin;Encyclopedia of Machine Learning;;2010;learning-ensamble;learning-ensamble;
Manning:2008:IIR:1394399;"Manning, Christopher D. and Raghavan, Prabhakar and Sch\""{u}tze, Hinrich";Introduction to Information Retrieval;;2008;feature-weight;feature-weight, document-representation, feature-selection, evaluation-methods;
DBLP:books/sp/HerreraVBCZSV16;Francisco Herrera and Sebasti{\'{a}}n Ventura and Rafael Bello and Chris Cornelis and Amelia Zafra and D{\'{a}}nel S{\'{a}}nchez Tarrag{\'{o}} and Sarah Vluymans;Multiple Instance Learning - Foundations and Algorithms;;2016;learning-multiple-instance;learning-multiple-instance;
nla.cat-vn2329663;Mardia, K. V. and Kent, J. T. and Bibby, J. M.;Multivariate analysis;;1979;feature-projection;feature-projection;
books/daglib/0082602;Schürmann, Jürgen;Pattern classification - a unified view of statistical and neural approaches.;;1996;feature-selection;feature-selection;
Ripley:1995:PRN:546466;Ripley, Brian D. and Hjort, N. L.;Pattern Recognition and Neural Networks;;1995;feature-projection;feature-projection;
Hand2001;Hand, David J and Mannila, Heikki and Smyth, Padhraic;Principles of data mining;;2001;document-representation;document-representation;
Aas1999;Aas, Kjersti and Eikvil, Line;Text categorisation: A survey;;1999;review-survey-overview-works;review-survey-overview-works;
Liu:2006:WDM:1215470;Liu, Bing;Web Data Mining: Exploring Hyperlinks, Contents, and Usage Data (Data-Centric Systems and Applications);;2006;;;
Aggarwal2015;Aggarwal, Charu C;Data mining: the textbook;;2015;;;
